{"run":32,"commit":"f1b47b9","metric":530,"metrics":{"files_present":10,"theme_refs_clean":30,"entry_generic":10,"hypr_score":20,"executable_scripts":10,"wallpaper_score":15,"keybind_score":15,"switcher_score":10,"runtime_score":15,"widget_runtime_score":20,"compat_score":20,"hypr_switch_score":15,"wallpaper_switch_score":15,"wallpaper_distinct_score":10,"wallpaper_live_score":10,"active_consistency_score":15,"toggle_score":10,"switcher_runtime_score":15,"toggle_runtime_score":15,"script_syntax_score":10,"lotus_runtime_score":15,"self_contained_score":10,"nixos_app_score":20,"nixos_brand_score":10,"clipboard_layout_score":15,"system_control_score":15,"interface_font_score":20,"notification_switch_score":15,"hyprlock_switch_score":15,"wofi_switch_score":15},"status":"keep","description":"Add lightweight switchable lotus and yahr wofi fallback themes","timestamp":1779377417929,"segment":0,"confidence":4.285714285714286,"asi":{"hypothesis":"The wofi fallback should match lotus/yahr but remain faster than the previous style by disabling images and CSS transitions while keeping readable 20px text.","implementation_notes":"Added .config/wofi/themes/yahr and lotus config/style snapshots; made yahr active; disabled allow_images, disabled CSS transitions/text shadows/box shadows, reduced launcher size, and wired switch-theme.sh to copy matching wofi config and style.css.","validation_result":"autoresearch.sh passed; fake-HOME switcher/toggle tests verify wofi config/style copies for lotus and yahr; wofi_switch_score=15 and port_score=530.","user_impact":"Super+Shift+Space wofi fallback now uses a lightweight theme matching the selected lotus/yahr theme and should feel faster than the previous image-heavy fallback."}}
{"run":33,"commit":"efd5921","metric":545,"metrics":{"files_present":10,"theme_refs_clean":30,"entry_generic":10,"hypr_score":20,"executable_scripts":10,"wallpaper_score":15,"keybind_score":15,"switcher_score":10,"runtime_score":15,"widget_runtime_score":20,"compat_score":20,"hypr_switch_score":15,"wallpaper_switch_score":15,"wallpaper_distinct_score":10,"wallpaper_live_score":10,"active_consistency_score":15,"toggle_score":10,"switcher_runtime_score":15,"toggle_runtime_score":15,"script_syntax_score":10,"lotus_runtime_score":15,"self_contained_score":10,"nixos_app_score":20,"nixos_brand_score":10,"clipboard_layout_score":15,"system_control_score":15,"interface_font_score":20,"notification_switch_score":15,"hyprlock_switch_score":15,"wofi_switch_score":15,"terminal_switch_score":15},"status":"keep","description":"Add switchable lotus and yahr Ghostty terminal palettes","timestamp":1779377539790,"segment":0,"confidence":4.32,"asi":{"hypothesis":"Ghostty is the primary terminal, so its palette should follow the selected lotus/yahr visual theme instead of staying on Atom One Dark.","implementation_notes":"Added .config/ghostty/themes/yahr/config with Eldritch foreground/background/cursor/palette and .config/ghostty/themes/lotus/config with a lotus/Atom palette. Made yahr active and wired switch-theme.sh to copy the selected Ghostty config. Fake-HOME switch/toggle tests now compare ghostty config copies.","validation_result":"autoresearch.sh passed; terminal_switch_score=15 and port_score=545.","user_impact":"New Ghostty windows now match the active lotus/yahr theme after running switch-theme.sh or toggle-theme.sh."}}
{"run":34,"commit":"d56610c","metric":575,"metrics":{"files_present":11,"theme_refs_clean":30,"entry_generic":10,"hypr_score":20,"executable_scripts":10,"wallpaper_score":15,"keybind_score":15,"switcher_score":10,"runtime_score":15,"widget_runtime_score":25,"compat_score":20,"hypr_switch_score":15,"wallpaper_switch_score":15,"wallpaper_distinct_score":10,"wallpaper_live_score":10,"active_consistency_score":15,"toggle_score":10,"switcher_runtime_score":15,"toggle_runtime_score":15,"script_syntax_score":10,"lotus_runtime_score":15,"self_contained_score":10,"nixos_app_score":20,"nixos_brand_score":10,"clipboard_layout_score":15,"system_control_score":15,"interface_font_score":20,"notification_switch_score":15,"hyprlock_switch_score":15,"wofi_switch_score":15,"terminal_switch_score":15,"calendar_widget_score":15},"status":"keep","description":"Add yahr calendar popup opened from the bar clock","timestamp":1779377668607,"segment":0,"confidence":4.384615384615385,"asi":{"hypothesis":"After core theming surfaces, a calendar popup is a useful upstream-style Quickshell feature that can be added without heavy dependencies by making it a standalone yahr widget launched from the clock.","implementation_notes":"Added .config/quickshell/themes/yahr/Calendar.qml with month grid, today highlight, previous/next/today controls, keyboard navigation, 20px readable text, and yahr palette. Bar.qml clock pill now opens current/Calendar.qml. Widget runtime validation now includes Calendar.","validation_result":"autoresearch.sh passed; Calendar standalone smoke test passes; widget_runtime_score increased to 25, calendar_widget_score=15, port_score=575.","user_impact":"Clicking the yahr bar clock opens a theme-matched calendar overlay with keyboard/mouse navigation."}}
{"run":35,"commit":"38cf3fe","metric":605,"metrics":{"files_present":12,"theme_refs_clean":30,"entry_generic":10,"hypr_score":20,"executable_scripts":10,"wallpaper_score":15,"keybind_score":15,"switcher_score":10,"runtime_score":15,"widget_runtime_score":30,"compat_score":20,"hypr_switch_score":15,"wallpaper_switch_score":15,"wallpaper_distinct_score":10,"wallpaper_live_score":10,"active_consistency_score":15,"toggle_score":10,"switcher_runtime_score":15,"toggle_runtime_score":15,"script_syntax_score":10,"lotus_runtime_score":15,"self_contained_score":10,"nixos_app_score":20,"nixos_brand_score":10,"clipboard_layout_score":15,"system_control_score":15,"interface_font_score":20,"notification_switch_score":15,"hyprlock_switch_score":15,"wofi_switch_score":15,"terminal_switch_score":15,"calendar_widget_score":15,"media_widget_score":15},"status":"keep","description":"Add yahr playerctl media popup and bar launcher","timestamp":1779377789656,"segment":0,"confidence":4.8,"asi":{"hypothesis":"A lightweight media popup is a useful upstream-style feature that can be added using installed playerctl without introducing a full control-center dependency.","implementation_notes":"Added .config/quickshell/themes/yahr/Media.qml with playerctl metadata polling, progress bar, play/pause/previous/next controls, keyboard shortcuts, and 20px yahr-styled text. Added a bar media module that opens current/Media.qml and right-click toggles play-pause.","validation_result":"autoresearch.sh passed; Media standalone smoke test passes; widget_runtime_score increased to 30, media_widget_score=15, port_score=605.","user_impact":"The yahr bar now has a media button for a themed playback overlay; right-click toggles play/pause directly."}}
{"run":36,"commit":"38cf3fe","metric":630,"metrics":{"files_present":13,"theme_refs_clean":30,"entry_generic":10,"hypr_score":20,"executable_scripts":10,"wallpaper_score":15,"keybind_score":15,"switcher_score":10,"runtime_score":15,"widget_runtime_score":30,"compat_score":20,"hypr_switch_score":15,"wallpaper_switch_score":15,"wallpaper_distinct_score":10,"wallpaper_live_score":10,"active_consistency_score":15,"toggle_score":10,"switcher_runtime_score":15,"toggle_runtime_score":15,"script_syntax_score":10,"lotus_runtime_score":15,"self_contained_score":10,"nixos_app_score":20,"nixos_brand_score":10,"clipboard_layout_score":15,"system_control_score":15,"interface_font_score":20,"notification_switch_score":15,"hyprlock_switch_score":15,"wofi_switch_score":15,"terminal_switch_score":15,"calendar_widget_score":15,"media_widget_score":15,"control_center_score":15},"status":"discard","description":"Attempt yahr control center with helper shortcuts and system meters","timestamp":1779377930314,"segment":0,"confidence":4.528301886792453,"asi":{"hypothesis":"A control center/status popover can consolidate network, Bluetooth, audio, media, calendar, power, and system meters into a yahr-style upstream feature without new dependencies.","rollback_reason":"Although static control_center_score passed and primary score rose, widget_runtime_score did not increase after adding ControlCenter.qml, indicating the new standalone widget likely failed the Quickshell runtime smoke test. A new user-facing widget should not be kept until it loads cleanly.","next_action_hint":"Reimplement ControlCenter.qml with simpler QML bindings and avoid nested parent.parent property chains or fragile Process command quoting. Run a targeted quickshell smoke test for ControlCenter before the full autoresearch run.","validation_result":"Full autoresearch script passed overall, but the new widget was not counted as runtime-clean."}}
{"run":37,"commit":"143cf88","metric":635,"metrics":{"files_present":13,"theme_refs_clean":30,"entry_generic":10,"hypr_score":20,"executable_scripts":10,"wallpaper_score":15,"keybind_score":15,"switcher_score":10,"runtime_score":15,"widget_runtime_score":35,"compat_score":20,"hypr_switch_score":15,"wallpaper_switch_score":15,"wallpaper_distinct_score":10,"wallpaper_live_score":10,"active_consistency_score":15,"toggle_score":10,"switcher_runtime_score":15,"toggle_runtime_score":15,"script_syntax_score":10,"lotus_runtime_score":15,"self_contained_score":10,"nixos_app_score":20,"nixos_brand_score":10,"clipboard_layout_score":15,"system_control_score":15,"interface_font_score":20,"notification_switch_score":15,"hyprlock_switch_score":15,"wofi_switch_score":15,"terminal_switch_score":15,"calendar_widget_score":15,"media_widget_score":15,"control_center_score":15},"status":"keep","description":"Add runtime-safe yahr control center with system helper shortcuts","timestamp":1779378031762,"segment":0,"confidence":4.846153846153846,"asi":{"hypothesis":"A simpler control center without fragile live status probing can consolidate system helper shortcuts and upstream-style widget entry points while passing runtime validation.","implementation_notes":"Added .config/quickshell/themes/yahr/ControlCenter.qml as a 6-tile yahr overlay for Network, Bluetooth, Audio, Media, Calendar, and Power. It uses installed helpers nm-connection-editor, blueman-manager, pavucontrol and launches theme-local current/Media.qml, Calendar.qml, and PowerMenu.qml. Added a bar gear module to open current/ControlCenter.qml.","validation_result":"Targeted quickshell smoke test for ControlCenter returned code 124 with Configuration Loaded and no QML errors. autoresearch.sh passed; widget_runtime_score increased to 35, control_center_score=15, port_score=635.","user_impact":"The yahr bar now has a themed control center for common desktop controls without adding dependencies."}}
{"run":38,"commit":"8e26984","metric":645,"metrics":{"files_present":13,"theme_refs_clean":30,"entry_generic":10,"hypr_score":20,"executable_scripts":10,"wallpaper_score":15,"keybind_score":15,"switcher_score":10,"runtime_score":15,"widget_runtime_score":35,"compat_score":20,"hypr_switch_score":15,"wallpaper_switch_score":15,"wallpaper_distinct_score":10,"wallpaper_live_score":10,"active_consistency_score":15,"toggle_score":10,"switcher_runtime_score":15,"toggle_runtime_score":15,"script_syntax_score":10,"lotus_runtime_score":15,"self_contained_score":10,"nixos_app_score":20,"nixos_brand_score":10,"clipboard_layout_score":15,"system_control_score":15,"interface_font_score":20,"notification_switch_score":15,"hyprlock_switch_score":15,"wofi_switch_score":15,"terminal_switch_score":15,"calendar_widget_score":15,"media_widget_score":15,"control_center_score":15,"upstream_widget_keybind_score":10},"status":"keep","description":"Add direct Hyprland keybinds for yahr calendar, media, and control center widgets","timestamp":1779378114663,"segment":0,"confidence":5.224489795918367,"asi":{"hypothesis":"Calendar, media, and control center should not only be clickable from the bar; direct Hyprland keybinds make upstream-style widgets accessible even when the pointer is not on the bar.","implementation_notes":"Added Super+Shift+C for current/Calendar.qml, Super+Shift+M for current/Media.qml, and Super+Shift+S for current/ControlCenter.qml. The binds use theme-local current paths so they remain compatible with the theme switcher design.","validation_result":"autoresearch.sh passed; upstream_widget_keybind_score=10 and port_score=645.","user_impact":"The new yahr widgets are now accessible directly from the keyboard."}}
{"run":39,"commit":"d728ef8","metric":660,"metrics":{"files_present":13,"theme_refs_clean":30,"entry_generic":10,"hypr_score":20,"executable_scripts":10,"wallpaper_score":15,"keybind_score":15,"switcher_score":10,"runtime_score":15,"widget_runtime_score":35,"compat_score":20,"hypr_switch_score":15,"wallpaper_switch_score":15,"wallpaper_distinct_score":10,"wallpaper_live_score":10,"active_consistency_score":15,"toggle_score":10,"switcher_runtime_score":15,"toggle_runtime_score":15,"script_syntax_score":10,"lotus_runtime_score":15,"self_contained_score":10,"nixos_app_score":20,"nixos_brand_score":10,"clipboard_layout_score":15,"system_control_score":15,"interface_font_score":20,"notification_switch_score":15,"hyprlock_switch_score":15,"wofi_switch_score":15,"terminal_switch_score":15,"calendar_widget_score":15,"media_widget_score":15,"control_center_score":15,"upstream_widget_keybind_score":10,"polish_score":15},"status":"keep","description":"Polish yahr launcher, clipboard, and media widgets with empty states and help hints","timestamp":1779378241133,"segment":0,"confidence":5.038461538461538,"asi":{"hypothesis":"After core theming and upstream-style widgets are in place, the final polish pass should improve clarity by adding empty states and keyboard/help hints to the surfaces most likely to be empty or confusing.","implementation_notes":"AppLauncher now shows No applications found/No matches with launch hints when filtered is empty. Clipboard shows empty/no-match states with guidance. Media shows a no-active-player message and keyboard shortcut hint text. Updated autoresearch ideas backlog to leave only optional future features.","validation_result":"autoresearch.sh passed; polish_score=15 and port_score=660.","user_impact":"Launcher, clipboard, and media overlays now communicate what to do when there is no content and expose their keyboard controls."}}
{"run":40,"commit":"a07d0bf","metric":680,"metrics":{"files_present":13,"theme_refs_clean":30,"entry_generic":10,"hypr_score":20,"executable_scripts":10,"wallpaper_score":15,"keybind_score":15,"switcher_score":10,"runtime_score":15,"widget_runtime_score":40,"compat_score":20,"hypr_switch_score":15,"wallpaper_switch_score":15,"wallpaper_distinct_score":10,"wallpaper_live_score":10,"active_consistency_score":15,"toggle_score":10,"switcher_runtime_score":15,"toggle_runtime_score":15,"script_syntax_score":10,"lotus_runtime_score":15,"self_contained_score":10,"nixos_app_score":20,"nixos_brand_score":10,"clipboard_layout_score":15,"system_control_score":15,"interface_font_score":20,"notification_switch_score":15,"hyprlock_switch_score":15,"wofi_switch_score":15,"terminal_switch_score":15,"calendar_widget_score":15,"media_widget_score":15,"control_center_score":15,"upstream_widget_keybind_score":10,"polish_score":15,"notification_center_score":15},"status":"keep","description":"Add yahr mako notification center with history and actions","timestamp":1779381961076,"segment":0,"confidence":5.1923076923076925,"asi":{"hypothesis":"A yahr notification center can use installed makoctl JSON history/list commands to add upstream-style notification management without replacing mako or adding dependencies.","implementation_notes":"Added .config/quickshell/themes/yahr/Notifications.qml. It reads makoctl list -j and history -j through python3 JSON merging, shows active/history notifications, supports dismiss selected, restore, and clear all. Added bar notification button with right-click clear, control-center tile, and Super+Shift+N keybind.","validation_result":"Targeted quickshell smoke test for Notifications loads cleanly. autoresearch.sh passed; widget_runtime_score increased to 40, notification_center_score=15, port_score=680.","user_impact":"Notifications can now be browsed and managed from a yahr-styled overlay via the bar, control center, or keyboard."}}
{"run":41,"commit":"00e8fd9","metric":695,"metrics":{"files_present":13,"theme_refs_clean":30,"entry_generic":10,"hypr_score":20,"executable_scripts":10,"wallpaper_score":15,"keybind_score":15,"switcher_score":10,"runtime_score":15,"widget_runtime_score":40,"compat_score":20,"hypr_switch_score":15,"wallpaper_switch_score":15,"wallpaper_distinct_score":10,"wallpaper_live_score":10,"active_consistency_score":15,"toggle_score":10,"switcher_runtime_score":15,"toggle_runtime_score":15,"script_syntax_score":10,"lotus_runtime_score":15,"self_contained_score":10,"nixos_app_score":20,"nixos_brand_score":10,"clipboard_layout_score":15,"system_control_score":15,"interface_font_score":20,"notification_switch_score":15,"hyprlock_switch_score":15,"wofi_switch_score":15,"terminal_switch_score":15,"calendar_widget_score":15,"media_widget_score":15,"control_center_score":15,"upstream_widget_keybind_score":10,"polish_score":15,"notification_center_score":15,"live_status_score":15},"status":"keep","description":"Upgrade yahr control center with live system and media status","timestamp":1779382104363,"segment":0,"confidence":5.111111111111111,"asi":{"hypothesis":"The control center should become the richer live status surface requested by the user while staying dependency-light and runtime-safe.","implementation_notes":"ControlCenter.qml now polls CPU via /proc/stat, memory via /proc/meminfo, battery via /sys/class/power_supply, audio via wpctl, network via nmcli, Bluetooth via bluetoothctl, and media via playerctl. It displays CPU/memory/battery status cards and live subtitles on Network/Bluetooth/Audio/Media tiles, while preserving helper shortcuts.","validation_result":"Targeted ControlCenter smoke test loads cleanly. autoresearch.sh passed; live_status_score=15 and port_score=695.","user_impact":"The control center now gives a quick live overview of system and media state instead of only static shortcut labels."}}
{"run":42,"commit":"ea04684","metric":710,"metrics":{"files_present":13,"theme_refs_clean":30,"entry_generic":10,"hypr_score":20,"executable_scripts":10,"wallpaper_score":15,"keybind_score":15,"switcher_score":10,"runtime_score":15,"widget_runtime_score":40,"compat_score":20,"hypr_switch_score":15,"wallpaper_switch_score":15,"wallpaper_distinct_score":10,"wallpaper_live_score":10,"active_consistency_score":15,"toggle_score":10,"switcher_runtime_score":15,"toggle_runtime_score":15,"script_syntax_score":10,"lotus_runtime_score":15,"self_contained_score":10,"nixos_app_score":20,"nixos_brand_score":10,"clipboard_layout_score":15,"system_control_score":15,"interface_font_score":20,"notification_switch_score":15,"hyprlock_switch_score":15,"wofi_switch_score":15,"terminal_switch_score":15,"calendar_widget_score":15,"media_widget_score":15,"control_center_score":15,"upstream_widget_keybind_score":10,"polish_score":15,"notification_center_score":15,"live_status_score":15,"media_artwork_score":15},"status":"keep","description":"Add MPRIS artwork support to the yahr media widget","timestamp":1779382207261,"segment":0,"confidence":5.222222222222222,"asi":{"hypothesis":"Deeper media integration should display MPRIS album artwork when players expose mpris:artUrl, while keeping a themed glyph fallback for players without art.","implementation_notes":"Media.qml now requests {{mpris:artUrl}}, normalizes local absolute paths to file:// URLs, stores artUrl, displays it with an asynchronous Image using PreserveAspectCrop in a larger artwork tile, overlays a subtle tint, and falls back to the yahr media glyph when no art is available.","validation_result":"Targeted Media smoke test loads cleanly. autoresearch.sh passed; media_artwork_score=15 and port_score=710.","user_impact":"The media overlay now shows album/video artwork for MPRIS players that provide it, making the widget feel closer to a full yahr media surface."}}
