{"run":43,"commit":"289fab3","metric":725,"metrics":{"files_present":13,"theme_refs_clean":30,"entry_generic":10,"hypr_score":20,"executable_scripts":10,"wallpaper_score":15,"keybind_score":15,"switcher_score":10,"runtime_score":15,"widget_runtime_score":40,"compat_score":20,"hypr_switch_score":15,"wallpaper_switch_score":15,"wallpaper_distinct_score":10,"wallpaper_live_score":10,"active_consistency_score":15,"toggle_score":10,"switcher_runtime_score":15,"toggle_runtime_score":15,"script_syntax_score":10,"lotus_runtime_score":15,"self_contained_score":10,"nixos_app_score":20,"nixos_brand_score":10,"clipboard_layout_score":15,"system_control_score":15,"interface_font_score":20,"notification_switch_score":15,"hyprlock_switch_score":15,"wofi_switch_score":15,"terminal_switch_score":15,"calendar_widget_score":15,"media_widget_score":15,"control_center_score":15,"upstream_widget_keybind_score":10,"polish_score":15,"notification_center_score":15,"live_status_score":15,"media_artwork_score":15,"wallpaper_visibility_score":15},"status":"keep","description":"Replace too-dark yahr wallpaper and fix active hyprpaper theme consistency","timestamp":1779455561977,"segment":0,"confidence":5.333333333333333,"asi":{"hypothesis":"The user-visible black desktop is caused by the curated yahr wallpaper being too dark and active hyprpaper config being inconsistent/stale; replacing it with a brighter Eldritch asset and restoring direct yahr config should fix startup and switching visuals.","bug_found":"Active .config/hypr/hyprpaper.conf was a symlink to themes/lotus/hyprpaper.conf while containing yahr wallpaper content, and lotus hyprpaper/hyprlock snapshots had stale yahr references. The selected yahr PNG was also very dark/minimal.","implementation_notes":"Copied upstream Eldritch thumb-1920-443798.jpg into .config/quickshell/themes/yahr/wallpapers/eldritch.jpg, changed active and yahr hyprpaper configs to use it, restored lotus hyprpaper/hyprlock snapshots to lotus.jpg, updated yahr hyprlock to eldritch.jpg, and added wallpaper_visibility_score guarding against stale eldritch.png paths and symlinked active hyprpaper config.","validation_result":"autoresearch.sh passed; wallpaper_visibility_score=15 and port_score=725.","user_impact":"Yahr should now start with a visible teal Eldritch wallpaper instead of the nearly black octopus image, and lotus/yahr wallpaper switching is coherent again."}}
{"run":44,"commit":"871a660","metric":725,"metrics":{"files_present":13,"theme_refs_clean":30,"entry_generic":10,"hypr_score":20,"executable_scripts":10,"wallpaper_score":15,"keybind_score":15,"switcher_score":10,"runtime_score":15,"widget_runtime_score":40,"compat_score":20,"hypr_switch_score":15,"wallpaper_switch_score":15,"wallpaper_distinct_score":10,"wallpaper_live_score":10,"active_consistency_score":15,"toggle_score":10,"switcher_runtime_score":15,"toggle_runtime_score":15,"script_syntax_score":10,"lotus_runtime_score":15,"self_contained_score":10,"nixos_app_score":20,"nixos_brand_score":10,"clipboard_layout_score":15,"system_control_score":15,"interface_font_score":20,"notification_switch_score":15,"hyprlock_switch_score":15,"wofi_switch_score":15,"terminal_switch_score":15,"calendar_widget_score":15,"media_widget_score":15,"control_center_score":15,"upstream_widget_keybind_score":10,"polish_score":15,"notification_center_score":15,"live_status_score":15,"media_artwork_score":15,"wallpaper_visibility_score":15},"status":"keep","description":"Make Ghostty theme switching non-blocking for Home Manager read-only configs","timestamp":1779455897395,"segment":0,"confidence":4.721311475409836,"asi":{"hypothesis":"Theme switching should not fail when Ghostty is managed by Home Manager/Nix store and lacks writable ~/.config/ghostty/themes snapshots; terminal theming should be best-effort while all other theme surfaces still switch.","bug_found":"Live ~/.config/ghostty points into a Nix store Home Manager output and has no themes/yahr/config. switch-theme.sh treated Ghostty as mandatory and exited before switching other surfaces.","implementation_notes":"switch-theme.sh now computes repo_config_home from its script path, falls back to repo Ghostty theme snapshots when live ~/.config/ghostty/themes is absent, and copies Ghostty config only when destination config is writable. If Ghostty is read-only or missing, it prints a warning and continues switching Quickshell, Hyprland, hyprpaper, hyprlock, mako, and wofi.","validation_result":"Live ~/.config/quickshell/switch-theme.sh yahr no longer errors; it prints a Ghostty skip warning and switches theme. autoresearch.sh passed with terminal_switch_score=15 and port_score=725.","user_impact":"Running switch-theme.sh yahr works on the current Nix/Home Manager setup instead of stopping at 'Ghostty theme not found'."}}
