{"run":19,"commit":"1d5e7bb","metric":355,"metrics":{"files_present":10,"theme_refs_clean":30,"entry_generic":10,"hypr_score":20,"executable_scripts":10,"wallpaper_score":15,"keybind_score":15,"switcher_score":10,"runtime_score":15,"widget_runtime_score":20,"compat_score":20,"hypr_switch_score":15,"wallpaper_switch_score":15,"wallpaper_distinct_score":10,"wallpaper_live_score":10,"active_consistency_score":15,"toggle_score":10,"switcher_runtime_score":15},"status":"keep","description":"Add isolated fake-HOME runtime test for switch-theme.sh across lotus and yahr","timestamp":1779295314683,"segment":0,"confidence":5.384615384615385,"asi":{"hypothesis":"The switcher has accumulated enough responsibility that static greps are insufficient; running it for both themes in an isolated fake HOME validates real behavior without mutating the live session.","implementation_notes":"autoresearch.sh now copies .config/quickshell and .config/hypr to a temp HOME, stubs hyprctl/hyprpaper/quickshell/pkill as no-op commands, runs switch-theme.sh lotus and yahr, and verifies current symlink plus theme.conf and hyprpaper.conf match the selected snapshots.","validation_result":"The isolated switcher test passed for both lotus and yahr; switcher_runtime_score=15 and port_score=355.","tradeoff":"The test increases benchmark complexity slightly but catches real path/copy/symlink failures in the switcher while avoiding live-session side effects."}}
{"run":20,"commit":"136cc89","metric":370,"metrics":{"files_present":10,"theme_refs_clean":30,"entry_generic":10,"hypr_score":20,"executable_scripts":10,"wallpaper_score":15,"keybind_score":15,"switcher_score":10,"runtime_score":15,"widget_runtime_score":20,"compat_score":20,"hypr_switch_score":15,"wallpaper_switch_score":15,"wallpaper_distinct_score":10,"wallpaper_live_score":10,"active_consistency_score":15,"toggle_score":10,"switcher_runtime_score":15,"toggle_runtime_score":15},"status":"keep","description":"Add isolated fake-HOME runtime test for toggle-theme.sh alternating yahr and lotus","timestamp":1779295398312,"segment":0,"confidence":5.615384615384615,"asi":{"hypothesis":"After adding a static toggle check, the next useful validation is to execute toggle-theme.sh in the same isolated fake HOME and prove it alternates both directions while reusing switch-theme.sh.","implementation_notes":"autoresearch.sh now starts fake HOME at yahr, runs toggle-theme.sh and verifies lotus current/theme.conf/hyprpaper.conf, then runs toggle-theme.sh again and verifies yahr current/theme.conf/hyprpaper.conf.","validation_result":"The isolated toggle runtime test passed; toggle_runtime_score=15 and port_score=370.","tradeoff":"No production files changed besides autoresearch docs/scorer, but the benchmark has more behavioral validation and slightly more complexity."}}
{"run":21,"commit":"7926441","metric":380,"metrics":{"files_present":10,"theme_refs_clean":30,"entry_generic":10,"hypr_score":20,"executable_scripts":10,"wallpaper_score":15,"keybind_score":15,"switcher_score":10,"runtime_score":15,"widget_runtime_score":20,"compat_score":20,"hypr_switch_score":15,"wallpaper_switch_score":15,"wallpaper_distinct_score":10,"wallpaper_live_score":10,"active_consistency_score":15,"toggle_score":10,"switcher_runtime_score":15,"toggle_runtime_score":15,"script_syntax_score":10},"status":"keep","description":"Expand autoresearch static checks to run bash -n on all maintained Quickshell scripts","timestamp":1779295483281,"segment":0,"confidence":5.357142857142857,"asi":{"hypothesis":"The port now relies on multiple shell scripts, so syntax checking only list-apps.sh is insufficient; all maintained Quickshell scripts should pass bash -n.","implementation_notes":"autoresearch.sh now finds .config/quickshell scripts (*.sh and files under scripts/) and runs bash -n on each, awarding script_syntax_score only when all pass.","validation_result":"switch-theme.sh, toggle-theme.sh, and yahr/scripts/list-apps.sh all pass syntax checks; script_syntax_score=10 and port_score=380.","tradeoff":"No production config changed; scorer has stronger static validation for scripts."}}
{"run":22,"commit":"c5a921e","metric":395,"metrics":{"files_present":10,"theme_refs_clean":30,"entry_generic":10,"hypr_score":20,"executable_scripts":10,"wallpaper_score":15,"keybind_score":15,"switcher_score":10,"runtime_score":15,"widget_runtime_score":20,"compat_score":20,"hypr_switch_score":15,"wallpaper_switch_score":15,"wallpaper_distinct_score":10,"wallpaper_live_score":10,"active_consistency_score":15,"toggle_score":10,"switcher_runtime_score":15,"toggle_runtime_score":15,"script_syntax_score":10,"lotus_runtime_score":15},"status":"keep","description":"Add lotus main-shell runtime smoke test through the generic ThemeShell entry","timestamp":1779295596005,"segment":0,"confidence":5.379310344827586,"asi":{"hypothesis":"Rollback should validate the full lotus shell through the same generic ThemeShell entry, not just lotus AppLauncher compatibility.","implementation_notes":"autoresearch.sh now reuses the isolated shell.qml and tests both current -> yahr and current -> lotus, assigning runtime_score for yahr and lotus_runtime_score for lotus when Quickshell loads cleanly.","validation_result":"Both yahr and lotus main shells load without QML errors; lotus_runtime_score=15 and port_score=395.","tradeoff":"Adds another 2-second Quickshell launch to the experiment, but it validates the rollback path."}}
{"run":23,"commit":"d2db189","metric":435,"metrics":{"files_present":10,"theme_refs_clean":30,"entry_generic":10,"hypr_score":20,"executable_scripts":10,"wallpaper_score":15,"keybind_score":15,"switcher_score":10,"runtime_score":15,"widget_runtime_score":20,"compat_score":20,"hypr_switch_score":15,"wallpaper_switch_score":15,"wallpaper_distinct_score":10,"wallpaper_live_score":10,"active_consistency_score":15,"toggle_score":10,"switcher_runtime_score":15,"toggle_runtime_score":15,"script_syntax_score":10,"lotus_runtime_score":15,"self_contained_score":10,"nixos_app_score":20,"nixos_brand_score":10},"status":"keep","description":"Fix yahr launcher on NixOS, make helper path self-contained, and replace Arch icon with NixOS branding","timestamp":1779323237601,"segment":0,"confidence":5.733333333333333,"asi":{"hypothesis":"The user-visible launcher failure is caused by upstream FHS app paths and a non-NixOS shebang; adding NixOS desktop-entry paths and making AppLauncher self-contained should populate Super+Space without installing software.","bug_found":"list-apps.sh had #!/bin/bash, which fails on this NixOS system, and it omitted /run/current-system/sw/share/applications and /etc/profiles/per-user/$USER/share/applications, so it returned 0 apps.","implementation_notes":"Changed list-apps.sh to #!/usr/bin/env bash, added NixOS application directories, changed AppLauncher.qml to use Quickshell.shellDir + /scripts/list-apps.sh, and replaced the Arch glyph in yahr Bar.qml with the NixOS glyph .","validation_result":"list-apps.sh now returns 52 apps locally; all smoke tests pass; port_score=435 with nixos_app_score=20 and nixos_brand_score=10.","user_impact":"Super+Space should now show applications on NixOS, and the bar no longer shows the Arch icon."}}
{"run":24,"commit":"cdc962d","metric":450,"metrics":{"files_present":10,"theme_refs_clean":30,"entry_generic":10,"hypr_score":20,"executable_scripts":10,"wallpaper_score":15,"keybind_score":15,"switcher_score":10,"runtime_score":15,"widget_runtime_score":20,"compat_score":20,"hypr_switch_score":15,"wallpaper_switch_score":15,"wallpaper_distinct_score":10,"wallpaper_live_score":10,"active_consistency_score":15,"toggle_score":10,"switcher_runtime_score":15,"toggle_runtime_score":15,"script_syntax_score":10,"lotus_runtime_score":15,"self_contained_score":10,"nixos_app_score":20,"nixos_brand_score":10,"clipboard_layout_score":15},"status":"keep","description":"Replace lotus-derived yahr clipboard with centered yahr-style glass panel","timestamp":1779323371022,"segment":0,"confidence":5.5625,"asi":{"hypothesis":"The clipboard looked right-biased/weird because yahr Clipboard.qml was a recolored lotus design with lotus typography/decorative glyphs; replacing it with a centered yahr-style glass panel should align it with AppLauncher and improve usability.","implementation_notes":"Rewrote .config/quickshell/themes/yahr/Clipboard.qml with Theme.qml colors, centered 860px glass panel, yahr-style search header, simplified list rows, and preserved keyboard/mouse behavior for filter/copy/clear.","validation_result":"All existing smoke tests pass, including the yahr Clipboard standalone runtime test; clipboard_layout_score=15 and port_score=450.","user_impact":"Super+V should now show a centered yahr-styled clipboard panel instead of the lotus-derived layout."}}
{"run":25,"commit":"2b0f9cb","metric":465,"metrics":{"files_present":10,"theme_refs_clean":30,"entry_generic":10,"hypr_score":20,"executable_scripts":10,"wallpaper_score":15,"keybind_score":15,"switcher_score":10,"runtime_score":15,"widget_runtime_score":20,"compat_score":20,"hypr_switch_score":15,"wallpaper_switch_score":15,"wallpaper_distinct_score":10,"wallpaper_live_score":10,"active_consistency_score":15,"toggle_score":10,"switcher_runtime_score":15,"toggle_runtime_score":15,"script_syntax_score":10,"lotus_runtime_score":15,"self_contained_score":10,"nixos_app_score":20,"nixos_brand_score":10,"clipboard_layout_score":15,"system_control_score":15},"status":"keep","description":"Use installed NixOS helpers for yahr status modules and make audio icon volume-aware via wpctl","timestamp":1779323484398,"segment":0,"confidence":5.411764705882353,"asi":{"hypothesis":"The bar should explicitly align with installed NixOS helpers: keep external GNOME/Blueman/Pavucontrol tools, but use wpctl for PipeWire audio state because pactl is missing and wpctl is installed.","implementation_notes":"Updated yahr Bar.qml audioProbe to parse wpctl get-volume @DEFAULT_AUDIO_SINK@ and choose low/mid/high/mute icons. Right-click mute now uses wpctl set-mute @DEFAULT_AUDIO_SINK@ toggle instead of pamixer -t. Network/Bluetooth/Audio clicks remain nm-connection-editor, blueman-manager, and pavucontrol.","validation_result":"All smoke tests pass; system_control_score=15 and port_score=465.","user_impact":"WiFi, Bluetooth, and audio controls continue using installed external apps; audio icon should better reflect volume state and no longer depends on pactl."}}
{"run":26,"commit":"78da38d","metric":465,"metrics":{"files_present":10,"theme_refs_clean":30,"entry_generic":10,"hypr_score":20,"executable_scripts":10,"wallpaper_score":15,"keybind_score":15,"switcher_score":10,"runtime_score":15,"widget_runtime_score":20,"compat_score":20,"hypr_switch_score":15,"wallpaper_switch_score":15,"wallpaper_distinct_score":10,"wallpaper_live_score":10,"active_consistency_score":15,"toggle_score":10,"switcher_runtime_score":15,"toggle_runtime_score":15,"script_syntax_score":10,"lotus_runtime_score":15,"self_contained_score":10,"nixos_app_score":20,"nixos_brand_score":10,"clipboard_layout_score":15,"system_control_score":15},"status":"keep","description":"Increase yahr Quickshell status bar font and icon sizes to 20 with larger bar containers","timestamp":1779372638963,"segment":0,"confidence":5.257142857142857,"asi":{"hypothesis":"User requested larger Quickshell status bar text; increasing yahr bar text/icons to 20 and bar height should improve readability without breaking runtime validation.","implementation_notes":"Set yahr Theme.qml fontSizeIcon to 20, Bar.qml barHeight to 48, ClockPill text to 20, Module containers to 40, and WorkspaceBar labels to 20 with larger workspace cells.","validation_result":"All existing smoke tests pass. Current scorer does not yet include a font-size metric, so port_score remained 465.","user_impact":"Top bar status icons, workspace numbers, and clock should now render around 20px and avoid clipping with the taller bar."}}
{"run":27,"commit":"93abe76","metric":485,"metrics":{"files_present":10,"theme_refs_clean":30,"entry_generic":10,"hypr_score":20,"executable_scripts":10,"wallpaper_score":15,"keybind_score":15,"switcher_score":10,"runtime_score":15,"widget_runtime_score":20,"compat_score":20,"hypr_switch_score":15,"wallpaper_switch_score":15,"wallpaper_distinct_score":10,"wallpaper_live_score":10,"active_consistency_score":15,"toggle_score":10,"switcher_runtime_score":15,"toggle_runtime_score":15,"script_syntax_score":10,"lotus_runtime_score":15,"self_contained_score":10,"nixos_app_score":20,"nixos_brand_score":10,"clipboard_layout_score":15,"system_control_score":15,"interface_font_score":20},"status":"keep","description":"Increase yahr app launcher, clipboard, power menu, and mako notification fonts to 20px baseline","timestamp":1779372888519,"segment":0,"confidence":5.333333333333333,"asi":{"hypothesis":"User requested larger fonts across other interfaces; applying a consistent 20px baseline to yahr app launcher, clipboard, power menu, and mako notifications should improve readability while preserving runtime loadability.","implementation_notes":"Set yahr Theme.qml small/normal/large font sizes to 20, replaced app launcher/clipboard/power menu hardcoded small interface fonts with theme font sizes, enlarged rows/tiles/icons where needed, and added .config/mako/config with Eldritch colors and font=IoskeleyMono Nerd Font 20.","validation_result":"autoresearch.sh passed all static and Quickshell smoke tests; interface_font_score=20 and port_score increased to 485.","user_impact":"Search app interface, clipboard picker, power menu labels/hints, and notifications now use a readable 20px baseline instead of mixed 10-16px text."}}
{"run":28,"commit":"fc4cbfd","metric":500,"metrics":{"files_present":10,"theme_refs_clean":30,"entry_generic":10,"hypr_score":20,"executable_scripts":10,"wallpaper_score":15,"keybind_score":15,"switcher_score":10,"runtime_score":15,"widget_runtime_score":20,"compat_score":20,"hypr_switch_score":15,"wallpaper_switch_score":15,"wallpaper_distinct_score":10,"wallpaper_live_score":10,"active_consistency_score":15,"toggle_score":10,"switcher_runtime_score":15,"toggle_runtime_score":15,"script_syntax_score":10,"lotus_runtime_score":15,"self_contained_score":10,"nixos_app_score":20,"nixos_brand_score":10,"clipboard_layout_score":15,"system_control_score":15,"interface_font_score":20,"notification_switch_score":15},"status":"keep","description":"Add switchable lotus/yahr mako notification themes and reload them from the theme switcher","timestamp":1779374027337,"segment":0,"confidence":5.2105263157894735,"asi":{"hypothesis":"Notifications should be themed with the active lotus/yahr visual style and switched by the same safe theme switcher, otherwise mako remains visually disconnected from the Quickshell/Hyprland theme.","implementation_notes":"Added .config/mako/themes/yahr/config with Eldritch colors and 20px font, enlarged lotus mako theme to the same readable notification sizing, made switch-theme.sh copy $mako_target to $mako_dir/config and run makoctl reload, and extended fake-HOME switcher/toggle tests to verify mako config copies for both themes.","validation_result":"autoresearch.sh passed; notification_switch_score=15 and port_score increased to 500.","user_impact":"Running switch-theme.sh yahr/lotus or the theme toggle now also updates notification colors/fonts and reloads mako."}}
{"run":29,"commit":"fc4cbfd","metric":485,"metrics":{"files_present":10,"theme_refs_clean":30,"entry_generic":10,"hypr_score":20,"executable_scripts":10,"wallpaper_score":15,"keybind_score":15,"switcher_score":10,"runtime_score":15,"widget_runtime_score":20,"compat_score":20,"hypr_switch_score":15,"wallpaper_switch_score":15,"wallpaper_distinct_score":10,"wallpaper_live_score":10,"active_consistency_score":15,"toggle_score":10,"switcher_runtime_score":0,"toggle_runtime_score":0,"script_syntax_score":10,"lotus_runtime_score":15,"self_contained_score":10,"nixos_app_score":20,"nixos_brand_score":10,"clipboard_layout_score":15,"system_control_score":15,"interface_font_score":20,"notification_switch_score":15,"hyprlock_switch_score":15},"status":"discard","description":"Attempt to add switchable yahr/lotus hyprlock themes and switcher support","timestamp":1779376694366,"segment":0,"confidence":4.95,"asi":{"hypothesis":"Hyprlock is the next visible unported desktop surface; adding lotus/yahr hyprlock snapshots and having switch-theme.sh copy the selected lockscreen config should make locking consistent with the active theme.","rollback_reason":"Primary port_score fell from 500 to 485 because switcher_runtime_score and toggle_runtime_score dropped to 0, indicating the new switch-theme.sh checks for hyprlock paths broke the isolated fake-HOME switcher/toggle tests.","next_action_hint":"Reapply hyprlock support after diagnosing fake-HOME layout and ensuring switch-theme.sh creates/uses existing theme snapshot paths without path mismatches. Static hyprlock_switch_score reached 15, so the concept is sound; the regression is in switcher/toggle runtime integration.","validation_result":"Static hyprlock_switch_score reached 15, but runtime switcher/toggle regression makes this unsafe to keep."}}
{"run":30,"commit":"fc4cbfd","metric":485,"metrics":{"files_present":10,"theme_refs_clean":30,"entry_generic":10,"hypr_score":20,"executable_scripts":10,"wallpaper_score":15,"keybind_score":15,"switcher_score":10,"runtime_score":15,"widget_runtime_score":20,"compat_score":20,"hypr_switch_score":15,"wallpaper_switch_score":15,"wallpaper_distinct_score":10,"wallpaper_live_score":10,"active_consistency_score":15,"toggle_score":10,"switcher_runtime_score":0,"toggle_runtime_score":0,"script_syntax_score":10,"lotus_runtime_score":15,"self_contained_score":10,"nixos_app_score":20,"nixos_brand_score":10,"clipboard_layout_score":15,"system_control_score":15,"interface_font_score":20,"notification_switch_score":15,"hyprlock_switch_score":15},"status":"discard","description":"Retry switchable yahr/lotus hyprlock themes with active consistency coverage","timestamp":1779376808853,"segment":0,"confidence":4.5,"asi":{"hypothesis":"Hyprlock should be added as a switchable lotus/yahr surface with yahr active by default and included in active consistency checks.","rollback_reason":"Primary port_score remained below the current best because switcher_runtime_score and toggle_runtime_score still dropped to 0, despite static hyprlock_switch_score passing.","next_action_hint":"Do a focused debug run of the fake-HOME switcher command with stderr visible. Suspect the scorer preserved hyprlock runtime comparisons after discard while production switcher no longer has hyprlock copy logic, or switch-theme.sh validation is failing before copies. Need align scorer and implementation atomically.","validation_result":"Static hyprlock config/switcher checks passed, but isolated switch/toggle validation failed, so not safe to keep."}}
{"run":31,"commit":"30cb414","metric":515,"metrics":{"files_present":10,"theme_refs_clean":30,"entry_generic":10,"hypr_score":20,"executable_scripts":10,"wallpaper_score":15,"keybind_score":15,"switcher_score":10,"runtime_score":15,"widget_runtime_score":20,"compat_score":20,"hypr_switch_score":15,"wallpaper_switch_score":15,"wallpaper_distinct_score":10,"wallpaper_live_score":10,"active_consistency_score":15,"toggle_score":10,"switcher_runtime_score":15,"toggle_runtime_score":15,"script_syntax_score":10,"lotus_runtime_score":15,"self_contained_score":10,"nixos_app_score":20,"nixos_brand_score":10,"clipboard_layout_score":15,"system_control_score":15,"interface_font_score":20,"notification_switch_score":15,"hyprlock_switch_score":15},"status":"keep","description":"Add switchable yahr and lotus hyprlock themes with robust switcher copies","timestamp":1779376971103,"segment":0,"confidence":4.25,"asi":{"hypothesis":"Hyprlock is the next visible unported surface; adding theme snapshots and switching them with the same safe switcher should make lockscreen visuals consistent with yahr/lotus.","bug_found":"Initial attempts failed isolated switcher tests because active .config/hypr/hyprlock.conf was hardlinked/same-file after cp -a in the fake HOME, so cp source destination reported 'same file'.","implementation_notes":"Added .config/hypr/themes/yahr/hyprlock.conf using the yahr wallpaper, Eldritch palette, large clock/date/user labels, and 20px user label. Updated lotus hyprlock snapshot to use the local lotus wallpaper. switch-theme.sh now uses copy_config via mktemp+mv for all copied configs, including hyprlock, avoiding same-file cp failures.","validation_result":"Focused fake-HOME switcher debug passes for lotus and yahr; autoresearch.sh passes with hyprlock_switch_score=15 and port_score=515.","user_impact":"hyprlock now follows the selected lotus/yahr theme, and theme switching remains robust for Quickshell, Hyprland, hyprpaper, mako, and hyprlock."}}
